{
  "$schema": "http://json-schema.org/draft-07/schema#",
  "$id": "https://svrooij.io/sonos-api-docs/schema/template.json",
  "definitions": {
    "TemplateFile": {
      "properties": {
        "file": {
          "title": "Template filename",
          "type": "string"
        },
        "outputFile": {
          "title": "Output filename",
          "description": "How to output the file(s), '{service}' is replaced by the serviceName, '{snService}' is replaced by snakecase service name",
          "type": "string"
        },
        "usage": {
          "title": "Template use",
          "description": "Is this template used for all services combined of per service",
          "type": "string",
          "enum": [
            "index",
            "service"
          ]
        }
      },
      "required": [
        "file",
        "outputFile",
        "usage"
      ],
      "type": "object"
    }
  },
  "title": "Template configuration",
  "properties": {
    "author": {
      "$ref": "author.json"
    },
    "files": {
      "title": "Templates to process",
      "items": {
        "$ref": "#/definitions/TemplateFile"
      },
      "type": "array",
      "minItems": 1
    },
    "name": {
      "title": "Name of the template",
      "type": "string"
    },
    "slug": {
      "title": "Slug of the template",
      "description": "Slug has to be unique and match the tempalte folder, to be included into the generator",
      "type": "string"
    },
    "dataTypes": {
      "title": "Replace data types, original type as key, new type as value",
      "additionalProperties": {
        "type":"string"
      },
      "type":"object"
    },
    "serviceData": {
      "title": "Add data to each service, to use in your templates",
      "additionalProperties": {
        "title": "Use the exact service name as key",
        "type":"object"
      },
      "type":"object"
    },
    "license": {
      "title": "License of the template",
      "description": "'MIT' is required to be included into the generator",
      "default": "MIT",
      "type":"string"
    }
  },
  "required": [
    "author",
    "files",
    "slug"
  ],
  "type": "object"
}